{
  "version": 1,
  "baseline_head": "ded862d817b91282b2a8f36196b0b31c12d56f23",
  "zero_test_modules": [
    "test_contract_authority_support"
  ],
  "local_profiles": {
    "3": [
      {
        "id": "local-1",
        "shards": [
          "s01",
          "s02",
          "s07",
          "s12",
          "s13"
        ]
      },
      {
        "id": "local-2",
        "shards": [
          "s03",
          "s05",
          "s06",
          "s11",
          "s14"
        ]
      },
      {
        "id": "local-3",
        "shards": [
          "s04",
          "s08",
          "s09",
          "s10"
        ]
      }
    ],
    "4": [
      {
        "id": "local-1",
        "shards": [
          "s02",
          "s12",
          "s13"
        ]
      },
      {
        "id": "local-2",
        "shards": [
          "s03",
          "s05",
          "s06",
          "s11"
        ]
      },
      {
        "id": "local-3",
        "shards": [
          "s01",
          "s04",
          "s10"
        ]
      },
      {
        "id": "local-4",
        "shards": [
          "s07",
          "s08",
          "s09",
          "s14"
        ]
      }
    ]
  },
  "$schema": "./test_shards.schema.json",
  "weighting": {
    "status": "observed-placement-model-unverified-in-CI",
    "observed_revision": "ded862d817b91282b2a8f36196b0b31c12d56f23",
    "terminal_module_observations": 125,
    "strict_PASS_modules": 121,
    "observed_case_outcomes": {
      "ok": 3389,
      "failure": 3,
      "error": 2
    },
    "unknown_successful_method_costs": 5,
    "unknown_allocation_reserve_seconds": 240,
    "reserve_is_measured_successful_cost": false,
    "reserve_is_upper_bound": false,
    "selected_model": "parts-14-runbook-native-two-groups-reserve-240",
    "split_existing_whole_method_groups": {
      "InitCapture": 3,
      "Shell": 2,
      "Closeout": 2,
      "NativeSibling": 2
    },
    "PublicSibling": "whole-class",
    "model_sigma": 1,
    "CI_sigma": null,
    "CI_extra_seconds": null,
    "predicted_successful_CI_seconds": null,
    "target_test_part_minutes": [
      20,
      25
    ],
    "target_verified": false,
    "provenance_sha256": {
      "frozen_inputs": "01f1f44246f97c4e6ae29680346ea502e5e9cf8a3aa00561167538c0526f3630",
      "module_map": "ce413777881f5dc822b7d16c9759d3605050dbb7d80894e1b6af8b858a160108",
      "case_outcomes": "e17f254f5cf0d72eed5f1fe3036ca83fce9d6966f7f6b0f5b7f820052a5af326",
      "reserve_sensitivity": "1aaa604d398f22fe012a67ce8bf36164b424bc73cee23701acec9d529c92af88"
    }
  },
  "shards": [
    {
      "id": "s01",
      "selectors": [
        {
          "module": "test_contract_authority_shell",
          "ids": [
            "test_contract_authority_shell.ContractAuthorityShellIntegrationTests.test_api_guard_rejects_unsupported_api_for_pinned_and_unattested_sources",
            "test_contract_authority_shell.ContractAuthorityShellIntegrationTests.test_api_one_range_rejects_pinned_and_unattested_sources",
            "test_contract_authority_shell.ContractAuthorityShellIntegrationTests.test_clean_first_source_pins_and_same_source_is_idempotent",
            "test_contract_authority_shell.ContractAuthorityShellIntegrationTests.test_dirty_or_non_git_initial_source_stays_unattested_after_runtime_becomes_clean",
            "test_contract_authority_shell.ContractAuthorityShellIntegrationTests.test_fake_and_exported_readonly_source_assertions_are_rejected",
            "test_contract_authority_shell.ContractAuthorityShellIntegrationTests.test_initially_unattested_legacy_shell_remains_usable_and_unpinned_after_clean_commit",
            "test_contract_authority_shell.ContractAuthorityShellIntegrationTests.test_public_pi_checkpointed_replay_pairs_semantic_reason_before_stdin",
            "test_contract_authority_shell.ContractAuthorityShellIntegrationTests.test_public_pi_composition_materialized_duplicate",
            "test_contract_authority_shell.ContractAuthorityShellIntegrationTests.test_public_pi_differing_input_replay_pairs_semantic_error",
            "test_contract_authority_shell.ContractAuthorityShellIntegrationTests.test_public_pi_facade_runs_all_general_roles_and_v2_replay",
            "test_contract_authority_shell.ContractAuthorityShellIntegrationTests.test_public_pi_missing_cycle_pairs_semantic_reason_and_preserves_fixture",
            "test_contract_authority_shell.ContractAuthorityShellIntegrationTests.test_public_pi_phase_drift_after_stdin_blocks_all_collector_effects",
            "test_contract_authority_shell.ContractAuthorityShellIntegrationTests.test_public_pi_pre_admission_negative_matrix_keeps_stdin_and_pi_map_unread",
            "test_contract_authority_shell.ContractAuthorityShellIntegrationTests.test_public_pi_rebuild_derived_flag_pairs_semantic_private_rejection",
            "test_contract_authority_shell.ContractAuthorityShellIntegrationTests.test_source_state_requires_exact_global_readonly_scalar_variables",
            "test_contract_authority_shell.ContractAuthorityShellIntegrationTests.test_stale_timestamp_valid_context_bytecode_cannot_change_direct_plan_lint_import",
            "test_contract_authority_shell.ContractAuthorityShellIntegrationTests.test_stale_timestamp_valid_context_bytecode_cannot_change_shell_effect_context",
            "test_contract_authority_shell.ContractAuthorityShellIntegrationTests.test_target_mutation_after_declared_read_reaches_effect_with_current_content"
          ]
        },
        {
          "module": "test_sibling_runbook",
          "class": "OwnerAnswerTests"
        },
        {
          "module": "test_contract_authority_runtime"
        },
        {
          "module": "test_contract_authority_snapshot"
        },
        {
          "module": "test_followups_reconcile"
        },
        {
          "module": "test_ledger_lint"
        },
        {
          "module": "test_plan_handoff_digest"
        },
        {
          "module": "test_planveyor_admission_integration"
        },
        {
          "module": "test_planveyor_ai_gate_wrapper"
        },
        {
          "module": "test_planveyor_delivery_metrics"
        },
        {
          "module": "test_planveyor_shared_corpus_contract"
        },
        {
          "module": "test_portability_substitution"
        },
        {
          "module": "test_post_merge_receipt_skeleton"
        },
        {
          "module": "test_process_improvements"
        }
      ]
    },
    {
      "id": "s02",
      "selectors": [
        {
          "module": "test_contract_authority_shell",
          "ids": [
            "test_contract_authority_shell.ContractAuthorityShellIntegrationTests.test_bridge_ignores_target_modules_and_rejects_preloaded_foreign_authority_aliases",
            "test_contract_authority_shell.ContractAuthorityShellIntegrationTests.test_cached_interpreter_reuses_absolute_binary_after_path_change",
            "test_contract_authority_shell.ContractAuthorityShellIntegrationTests.test_context_capture_uses_one_bootstrap_runtime_verify",
            "test_contract_authority_shell.ContractAuthorityShellIntegrationTests.test_different_root_and_changed_revision_fail_before_existing_function_overwrite",
            "test_contract_authority_shell.ContractAuthorityShellIntegrationTests.test_direct_authority_consumers_install_bytecode_policy_before_runtime_imports",
            "test_contract_authority_shell.ContractAuthorityShellIntegrationTests.test_engaged_context_rejects_an_unexported_foreign_runtime_root_before_effect",
            "test_contract_authority_shell.ContractAuthorityShellIntegrationTests.test_engaged_prompt_and_template_read_current_target_content",
            "test_contract_authority_shell.ContractAuthorityShellIntegrationTests.test_first_source_under_nounset_keeps_module_loading_and_source_state",
            "test_contract_authority_shell.ContractAuthorityShellIntegrationTests.test_parent_context_requires_exact_caller_local_readonly_scalars",
            "test_contract_authority_shell.ContractAuthorityShellIntegrationTests.test_preseeded_or_missing_interpreter_cache_rejects_before_bridge",
            "test_contract_authority_shell.ContractAuthorityShellIntegrationTests.test_public_continuation_checkpoint_revalidates_fresh_bundle_and_replays_without_write",
            "test_contract_authority_shell.ContractAuthorityShellIntegrationTests.test_public_pi_blocked_recovery_requires_recorded_after_map_and_repairs_derived",
            "test_contract_authority_shell.ContractAuthorityShellIntegrationTests.test_public_pi_composition_clean_noop",
            "test_contract_authority_shell.ContractAuthorityShellIntegrationTests.test_public_pi_partial_recovery_replaces_one_blocked_carrier_truthfully",
            "test_contract_authority_shell.ContractAuthorityShellIntegrationTests.test_public_pi_post_admission_body_validation_pairs_semantic_error",
            "test_contract_authority_shell.ContractAuthorityShellIntegrationTests.test_public_pi_semantic_failure_after_backlog_recovers_exact_blocked_state",
            "test_contract_authority_shell.ContractAuthorityShellIntegrationTests.test_public_pi_unobservable_postmap_skips_fabricated_blocked_receipt",
            "test_contract_authority_shell.ContractAuthorityShellIntegrationTests.test_runtime_closure_and_runner_policy_drift_fail_before_effect_sentinel"
          ]
        },
        {
          "module": "test_authority_closeout_context"
        },
        {
          "module": "test_contract_authority_loaded_code"
        },
        {
          "module": "test_contract_authority_readers"
        },
        {
          "module": "test_contract_authority_writers"
        },
        {
          "module": "test_doc_lint"
        },
        {
          "module": "test_docs_archive_restore"
        },
        {
          "module": "test_docs_archive_snapshot"
        },
        {
          "module": "test_docs_retrieve_outcome"
        },
        {